,title,content
184,Can I start investing immediately?,"Yes, you can start investing with Baroda m-invest without submitting any documents and that too instantly! If you are already KYC compliant, you can invest immediately. All you have to do is log on to Baroda m-invest.com, enter your PAN and bank details, and that’s it!
If you are not KYC compliant, the process takes 1-2 days. The moment you enter your PAN number on the app, the system tells you whether you are KYC compliant or not."
185,What documents do I need to register on Baroda m-invest?,"We do not need any physical documents or photocopies.
All we need is photographs of the following from your cell-phone camera:

PAN card
Cancelled cheque leaf
Address proof – like Aadhaar card, driving license, voter card, passport or recent utility bill or bank statement
Selfie
IPV (In Person Verification) video"
186,Why do you need a photograph of cancelled cheque leaf?,"This is a snap of your cheque leaf with ‘Cancelled’ written across it. Regulation necessitates that your bank account for routing investments is on your name. To do this, we require a cancelled cheque leaf with your name pre-printed on it. If your name does not appear on the cheque leaf, then you can photograph your latest account statement from the same bank. All investments will happen through this bank account."
187,Why do you need a photograph of address proof?,"As part of the KYC process, regulations require you to provide a snap of address proof: like passport, Aadhaar card, voters identity card, driving license, utility bills (telephone bills for landline only, electricity bill, gas bill not more than 6 months old), bank account statement (not more than 6 months old).
However, if you are already a KYC verified customer, you don’t need to provide this document."
188,Why do you need a photograph of PAN card?,"As per regulatory requirements, Permanent Account Number (PAN) for all investments in mutual funds is mandatory."
189,Why do you a need a selfie?,We use this as your photograph to make the KYC application.
190,How does payment happen?,"Once you have chosen your investment, you will be taken to a payment gateway. There, the net banking of your chosen bank will appear and allow you to make the transfer.
In case you have started a systematic investment (SIP), all future investments will happen automatically through a bank mandate. We will be sending you a simple mandate for signature once you make the investment now."
191,Minimum amount required to start an investment?,"Minimum investment for one-time transaction is Rs. 5,000 & for SIP it is Rs. 500."
192,How to invest in your own choice of funds other than the suggested one?,One can select Do It Yourself (DIY) option & click on the search option. Users can also select the filter option and choose funds AMC wise.
193,What is an SIP?,"An SIP is a systematic investment of a fixed sum of money every month into a mutual fund. It is one of the simplest, yet most effective ways to save money regularly and grow it over time. Once initiated, the process happens every month automatically from the bank account."
194,Can I invest variable amounts every month in an SIP?,SIP investment amount need to be fixed only. Variable in the amount is not possible.
195,How is an SIP initiated/executed?,"You can invest in an SIP through the Baroda m-invest app by clicking ‘build wealth’ or ‘save for a goal’ or ‘save tax’. In each case, you need to only specify the monthly amount you can invest. The system recommends the funds and once you accept, takes you to a payment gateway. Your net banking opens there and you make the first payment.
Thereafter, we contact you for getting your signature on a bank mandate (called ECS mandate). This authorises your bank to transfer the same fixed amount of money every month to the fund automatically on a pre-defined day. Thereafter no intervention is required from your side."
196,Can I cancel an SIP/ECS mandate?,"Yes, you can. You just need to write a mail to ask@barodaminvest.com"
197,What is the minimum period for which I need to stay invested? Is there a lock in period? Is there any penalty (exit load) for earlier redemption?,"There is no minimum period or lock-in unless you invest in tax-saving schemes. You have the option to withdraw your money at any time.
Some products have loads (i.e. small charge) on premature exit."
198,Can I transfer my investments from Baroda m-invest to another broker?,"Yes. As your investments are held in your name with the mutual fund, you can request them to transfer your investments to the code of another broker. In that case of course, you can no longer see your money on our app thereafter."
199,How do I make a withdrawal from my account? Are there any charges on funds withdrawal?,You can place a withdrawal request on the app itself. We do not charge any fee for withdrawal. So you can always make a withdrawal at any time.
200,How long does it take to get the money?,"It takes T+1 working day for liquid funds to credit & T+3 working days for Equity funds to credit. At time there are few funds which might credit the amount after T+5 or T+6 working days as well. It will depend on the turnaround time (TAT) for every fund.
You will also get a statement from the fund house confirming the withdrawal and giving you the latest statement."
201,Can I get the credit in a different bank account?,"No, for security of your money, redemption are credited only to the same bank account you invested from. If you have closed that account, you can submit a request for a change in bank details. Please contact Baroda m-invest at +91 22 3014 7666 for this purpose. When that is approved, you can request the redemption."
202,Can I see all my investments here?,"Yes, you can view all your investments through Baroda m-invest in one place in the app. Values are updated every working day to reflect the latest balance. You can click on any of the items to drill down into specific goals and funds."
203,Can I see the report immediately after a transaction is done?,"Yes, you can – under the ‘pending’ tab of the report. This means the transaction is successful, but the allotment of fund units is pending.
The fund units get allotted to you on the next working day after you have made the transaction. The feeds come 1-2 days after that, which is when you can start seeing it in the regular portfolio. Till then, it continues to show as pending."
204,Can I withdraw money?,"Yes, you can withdraw money at any time by tapping ‘withdraw’ in the navigation drawer. If there are any funds under lock-in (usually tax saving funds), they will not be available for withdrawal, though they will show in your reports."
205,Who can invest through Baroda m-invest?,"Any Indian national, NRI or person of Indian origin having an Indian PAN card can invest through Baroda m-invest. NRIs or PIOs staying in US and Canada cannot invest at this point of time.
Baroda m-invest is not available for companies, partnership, trust, etc. – you can invest only in your personal capacity."
206,What is the process to get started?,"There are 2 simple steps to get started:

As per regulation, you need to complete a simple one-time process to begin investing. You just need to take pictures of your pan card, cheque leaf and an address proof.
We will intimate once the regulatory process is completed and you can start investing."
207,"bob World Internet Banking
","bob World Internet is the Bank of Baroda’s internet banking facility that caters to your banking needs 24/7 from the comfort of your home or office. Bank of Baroda has created few easy steps to access your bank account. You can view your bank balance, FD status, manage multiple accounts while also being able to transfer funds virtually, request for issuance of cheque books, liquidate FDs created online, pay your utility bills, among many other services. Hassle-free internet banking facilities makes banking with Bank of Baroda the perfect experience."
208,"bob World Internet Banking : Benefits
","Funds transfer through IMPS/ NEFT or RTGS.
 
Tax payment made easy
 
Pay for utilities
 
Pay tuition fees.
 
Book rail & air tickets online
 
Multiple workflows for corporate user accounts
 
Bulk payment facility
 
Open online fixed deposit or recurring deposit
 
Stop payment.
 
IPO subscription
 
Debit Card Management- for Card issuance, set limit, PIN, block for debit cards
 
Quick Fund Transfer"
209,"bob World Internet Banking : How to Register?
","Download appropriate internet banking form from the Home Page - Click the Link under ""Download Application Form"" to download form for retail users/corporate users. You can also get it from the branch.
Retail: All Individual account holders should use the retail form.
Corporate: All non-individuals i.e., companies, partnership firms, HUFs, sole proprietors should use corporate form.
The form should be duly filled in, signed by all signatories i.e., all joint account holders in case of a joint account, all partners in case of a partnership firm etc.
The form should be submitted through the base branch where the customer is maintaining the account for processing.
Customer will get the User ID on their registered Email ID, or they can retrieve their user ID by using the option “Forgot User ID” which is available at the login page of the bob World Internet.
Upon receipt of the User ID over registered email, the user has to set their password by using the option “Set Password/Forgot Password” which is available at the login page of the bob World Internet.
Retail customers having our bank’s active debit card, can register themselves for bob World Internet from his office/home without visiting branches. A link ‘Online Registration using Debit Card’ is available on the login page of bob World Internet.
Login to the website using the User ID and password."
210,"bob World Internet Banking : Features
","Sr. No.	Functionality Launched	Description
1	Quick Fund Transfer	Instant Fund transfer without adding and waiting for beneficiary to be listed.
Limits:

Transaction limit for Retail customer: Rs. 25,000/- per day.
Maximum number of transactions per: 2
Transaction limit for Corporate Customer: Rs. 50,000/- per day.
Maximum number of transactions per: 2
2	Bulk NEFT / RTGS	Corporate customer can perform interbank transfer for multiple beneficiaries with single attempt. Transaction Limit: Rs. 30 Lakhs per transaction and Rs. 75 lakhs per day.
3	Debit Card Issuance & Management	Customer can apply for Debit Card and manage other card activities like:
Set daily debit card limit for ATM transactions
Set daily debit card limits for PoS and Ecommerce transactions
Block Debit Card
Set/Reset Debit Card PIN
Gift card can also be availed as per customer request
4	Corporate FDR	Corporate User can open Fixed Deposit online at their own without visiting branch
Manage multiple accounts
Once you have logged in with the help of your user id and password, you can access all your accounts-operative, fixed deposit, loan account from one place. If you have multiple accounts with Bank of Baroda, you can access all of them from one log in if you have a common customer id for them.
View account summaries
Now it is easier than ever as you can simply view the summaries of all your Bank of Baroda accounts from a single log in.
Generate account statements
Net banking is also where you will find all your accounts statements to view and download from.
Transaction history
Log in to generate your transaction history which is more detailed than your account summaries.
Cost Efficient
Most of the services are available free of cost.
Form 26AS
Free online viewing of Tax Credit Statement (Form 26 AS).
Online request
Switch mailing address/generation of ESBTR receipt - GRN/Generation of TDS Certificate/generation of Interest certificate of SB/TD/OD and Loan accounts/tracking of Loan status/get access to SPGRS/direct access to e-trade/download pensioner life certificate/navigate to NPS site and contribute to NPS/direct access to Baroda E-Trade, where customer can login using his/her credentials and can perform DEMAT transactions/Can check CIBIL score/Hot listing of Debit card.
E-Commerce
Free bill presentment/bill payment/online shopping/receive and view bills online/alert on pending bills/payment to IndiaFirst Life Insurance/payment to Baroda pioneer.
Donation
Free online temple/other donation/donation to Prime Minister Relief fund.
Mobile Alerts
Free mobile alerts of debit and credit transactions.
Mobile OTP (One Time Password)
To avoid non delivery or delayed delivery of OTP our IT team has developed CA MOBILE OTP application on mobile handset supporting Apple, Android, Windows, and Blackberry.
Services Support
Centralized dedicated Internet Banking Operations Team. 5000+ support centers all over India (branches).
Modeling
Modeling of loan/deposits.
Online FD (Fixed Deposit) Request
Customers including NRI/PIO with full transaction rights are provided facility to create online Term deposits by themselves with facility of its pre-mature closure.
Online RD (Recurring Deposit) Request
Domestic retail customers with full transaction rights are provided facility to create online Recurring deposits account by themselves with facility of its pre-mature Plosure.
Online self-registration
To reduce TAT (Turn Around Time) and to ease customer convenience, the online self-registration for bob World Internet by using the active Debit card is available for the retail customers.
User ID Retrieval & Resetting of Passwords
Online User ID retrieval & resetting of Passwords facility is available for both Retail as well as corporate customers in bob World Internet.
Linking of PPF (Public Provident Fund) & SSA accounts
Our retail customers can link, View, Deposit and delink their PPF & Sukanya Samriddhi accounts through bob World Internet.
View KVP (Kisan Vikas Patra) certificates inbob World Internet
The KVP customers can view their KVP certificate opened in BOB Branches by logging to their bob World Internet account.
Facility to Purchase SGB
Bank has launched the facility for purchasing of Sovereigns Gold Bond online through bob World Internet.
Online updation/addition/deletion of Nominee
Updation/addition/deletion of nominee can be possible through bob World Internet.
Digital Signature Authentication
Corporate user who wants to secure their net banking portal with personalized authentication can subscribe to this facility.
The transaction limits for various financial services for retail and corporate customers are provided in below table. The limits would be refreshed on daily basis.
Retail Customers: Revised limits
Category	Type of Transaction	Per Transaction	Daily	TAX Payment/Self-Linked
Retail Default	SHP/TPT/NEFT/RTGS/BULK UPLOAD –	10	25lakhs	per day.
Retail Default	IMPS (Lakhs)	Rs 5 Lakhs per transaction	Rs. 5 lakhs per day.
Retail Default: Tax payment and self-linked: Unlimited

Corporate Customers: Revised limits
Category	Type of Transaction	Per Transaction	Daily	TAX Payment/Self-Linked
Corporate Default	SHP/TPT/NEFT/RTGS/BULK UPLOAD (In Lakhs)	Rs. 30 Lakhs per transaction	Rs. 75 lakhs	per day.
Corporate Default	IMPS	Rs. 5 Lakhs per transaction	Rs. 5 lakhs per day.
Corporate Default: Tax payment and self-linked - Unlimited

The default limits for addition of beneficiaries for Retail and Corporate customers in a day are as under:

No. of Beneficiary	Retail	Corporate
Total Number of Beneficiaries per day (any mode of payment)	5	25
New Beneficiary addition Cooling Period
To further enhance the customer security and ease, Bank has standardized the cooling period for new beneficiary addition in bob World Internet for both retail and corporate customers.

The functioning of beneficiary addition cooling period for both Retail and Corporate customers is as under:

Beneficiary addition time	Transactions permitted on both Retail and Corporate
Immediately after addition of new beneficiary and up to first 4 hours	No financial transactions permitted on that beneficiary.
After expiry of 4 hours and up to next 24 hours	Maximum financial transactions up to total of Rs. 2 lakhs only is permitted on that beneficiary during this period.
After expiry of 28 hours (i.e. first 4 hours + next 24 hours)	Financial transactions allowed as per assigned limits with no restriction.
"
211,"What is bob World Internet?
","bob World Internet is an Internet Banking Application implemented by Bank of Baroda for its Retail as well as Corporate Customers. It offers a seamless and feature rich user interface designed specifically to cater to all the Banking needs to our valued customers. Using bob World Internet, customers will be able to perform round the clock banking at their convenience.

"
212,"Why to choose bob World Internet?
","The application offers 185+ banking services to its users such that the customers using bob World Internet need not visit branch to perform their day to day banking operations.

Few of the features of bob World Internet are:

ease of use
interactive and enhanced customer experience
Cost effective for customers and bank
Round the Clock anywhere online banking
128 bit SSL encryption making the application safe by following the security protocols
Meets market competition
Meets customer’s requirements"
213,"What is the eligibility criteria for bob World Internet?
","Mode of operation code	Eligible for Retail/Corporate
Self	Retail
Either or Survivor	Retail
Per-Pro	Retail
Anyone or Survivor or Survivors	Retail
Minor natural guardian operation by NG	Retail
Former or Survivor	Retail
Both Jointly or Survivor	Retail (View Only)
Operation through  Power of Attorney	Retail/ Corporate
Operation through Mandate	Retail/  Corporate
Karta or HUF	Corporate
Proprietor	Corporate
Any one partner	Corporate
Any Two Partners	Corporate
Any Three partners	Corporate
All Partners Jointly	Corporate
Any one Director	Corporate
Any two directors	Corporate
Any three Directors	Corporate
Managing Trustee	Corporate
Any one Trustee	Corporate
Any two Trustees	Corporate
Any three Trustees	Corporate
Managing Director	Corporate
President	Corporate
Secretary	Corporate
Treasurer	Corporate
President and Secretary Jointly	Corporate
Chairman or Vice Chairman and Secretary	Corporate
President and Treasurer Jointly	Corporate
Secretary and Treasurer	Corporate
Chairman or Treasurer	Corporate
Any two of President, Secretary and Treasurer	Corporate
Authorized signatory	Corporate
Any two authorized signatory	Corporate
Board Resolution	Corporate
Following Persons / Accounts are not eligible for “bob World Internet”

Illiterate account holder.
Dormant accounts.
Inoperative accounts.
Minor account holders (Minor above 10 with mode of operation as ""Minor Natural Guardian operated by NG"" can be provided net-banking where NG will be able to access the account. Minor of age below 15 cannot be provided net-banking on his name).
Accounts where garnishee/ attachment order is received.
"
214,"What are the features and benefits of bob World Internet?
","Bob World Internet offers a gamut of services like check balances, consolidated view of account statement, unlimited funds transfer to self-linked accounts, make payments using IMPS/NEFT/RTGS, SMS and e-mail alert on all transactions and activities, open FD/RD, online closure of FD/RD, request cheque book, apply & manage debit card, open DEMAT account, apply for IPO, pay Direct/Indirect taxes and State Taxes payment, Bill Payment, ASBA, Cheque Book Request, ePA, viewing of KVP certificates, etc.

Additional facilities available to corporate customers are: Bulk payment (on request), salary upload, maker-checker mode of payments, division maintenance, transaction limit enquiry, higher limit for financial transaction on request, etc.

bob World Internet is available in following modes:

Retail with View only rights
Corporate with View only rights
Retail with Transaction rights
Corporate with Transaction rights
The application is available in two languages Hindi and English.

It uses 128 bit encryption methodology. It uses strong encryption algorithm using AES 256. It performs device validation using OTP. Personal Assurance Message (PAM) to identify genuine website, CAPTCHA to validate not a robot, User-ID + Sign-on password + Captcha to login. Financial transactions are performed post login using Transaction password along with OTP or QnA based on risk score generated by system."
215,"How do I get access to bob World Internet Services?
","Individuals having an operative account with Bank of Baroda can access net-banking. Customers need to register for internet banking, to obtain a unique user-ID. They can set their Sign-On and Transaction Password themselves.

You can use the following channels to register for mobile banking.

Self-Registration using Debit Card details.
Mobile Banking “bob World” App > Login> Request Services> Internet banking Registration
Base Branch – submit duly filled registration form for Internet Banking.
Through Tab Banking in assisted mode
After registering himself the customer needs to visit www.bobibanking.com to avail the facility."
216,"Is bob World Internet safe?
","bob World Internet application is one of the most secure Internet Banking Application in industry as per customer survey conducted by Bank from time to time.

It uses 128 bit encryption methodology. It uses strong encryption algorithm using AES 256. It performs device validation using OTP. Personal Assurance Message (PAM) to identify genuine website, CAPTCHA to validate not a robot, User-ID + Sign-on password + Captcha to login. Financial transactions are performed post login using Transaction password along with OTP or QnA based on risk score generated by system."
217,"How can I manage multiple accounts with Internet Banking?
","Customer after logging in to bob World Internet can view all his operative accounts linked to his/her customer-ID under the accounts tab the default home page or dashboard set by the user. Accounts such as Savings Current, Deposit Loan, Public Provident Fund, Sukanya Samriddhi Account are visible and can be managed by user in self-mode.

"
218,"NACH E-Mandate
","The NACH (National Automated Clearing House) implemented by NPCI (National Payments Corporation of India) provides a robust, secure, and scalable platform, which is coupled with best-in-class security features and multilevel data validation. The process is entirely digital with no involvement of any physical forms or signatures at any point of time.

"
219,"NACH E-Mandate : Benefits
","Real-time e-mandate facility
 
Quick authentication process
 
End-to-end digital
 
Secure platform
 
Cost-efficient
 
Improves your CIBIL score
 
Easy recurring payments"
220,"NACH E-Mandate : How to Register?
","NACH E-Mandate registration process is a very simple 4 steps procedure. E-Mandate steps are as under :

Step 1: Starting E-Mandate Journey
To start, click on the NACH e-mandate link on our website.

Step 2: Validation of Loan Information
The link takes you to login of e-mandate page. Enter your 14-digit loan account number and the last 4 digits of your registered mobile number. After submitting, you receive an OTP on your registered mobile number. Enter the 6-digit OTP received and click on submit.

Step 3: Completion of E-Mandate form
After clicking submit, you move to the next step to complete your e-mandate form. The main page has a form, which is auto filled with your personal, loan and EMI details for your ease. The details we need from you are given below:

Type of debit account
Debit account number
Name of the bank
Type of authentication mode (Internet Banking/Debit Card)
Tick the Terms and Conditions box and then click on submit.

Step 4: Completion of Transaction
In the last step, you will be taken to the Bill Desk page. Here, you must check the accuracy of the data provided and your consent to complete the e-mandate form.

After verifying, click proceed to complete the authentication process. You will be redirected to your bank's website where you need to complete the transaction via Internet Banking or Debit Card.

Once the authentication process is complete you will get the NACH e-mandate receipt and confirmation on your registered email address. Please keep a print of the receipt for your future reference."
221,"WhatsApp Banking
","Bank of Baroda is pioneer in customer centric initiatives which aims to provide convenience in availing banking services with safety and security. We are pleased to announce the launch of ""New Digital Delivery channel – WhatsApp Banking"".

"
