,title,content
0,"bob World Tab
","‘bob World Tab’ is primarily a relationship based assisted mobility platform that facilitates a seamless journey for the branch users which helps expanding the CASA base of the branch and the Bank. Various Digital Products are also offered through this Platform by doing away with paperwork and ensuring complete Digitization while opening SB & Current Account of customers, thereby entailing superior Customer Services.

At present, below 17 schemes of SB accounts are being opened through TAB Banking:
Srl. No.	Name of Scheme	Scheme
1	Baroda Advantage SB Gen	SB 101
2	Baroda Advantage Pension Account	SB 114
3	Baroda Super saving	SB 117
4	Baroda Centenary Saving	SB 125
5	Baroda Bachat Mitra	SB 128
6	Baroda Jeevan Suraksha	SB 134
7	Baroda Champ	SB 156
8	Baroda Platinum	SB 171
9	Baroda Salary   Classic	SB 174
10	Baroda Salary Super	SB 175
11	Baroda Salary Premium	SB 176
12	Baroda Salary Privilege	SB 177
13	Baroda Sr. Citizen Privilege	SB 180
14	Baroda Mahila Shakti	SB 181
15	Baroda Jeevan Nidhi Scheme	SB 184
16	Baroda Defense Salary Package	SB 186
17	Baroda Home Loan linked SB Account	SB-152
Bank of Baroda has been consistently working towards innovative digital offerings and “Current Account Opening” is a part of digital transformation journey. Bank of Baroda has embarked upon digitizing its current account customer on-boarding process through tablets for instant account opening through bob World Tab. The aim is to provide superior banking experience and ease of on-boarding customers over traditional channels. This facility is available for customers to open accounts under sole proprietors, Individual, Non-individual and Partnership.

Presently below 5 Schemes are available for opening Current Account through Tab Banking:
Srl. No.	Name of Scheme	Scheme
1	Baroda Advantage Current Account	CA101
2	Baroda Premium Privilege Current Account	CA107
3	Baroda Premium Current Account	CA108
4	Baroda District Co-operatives Milk Account	CA123
5	Baroda Small Business Account	CA124
Additionally SB Non-individual accounts as SHG (Self Help Group) Accounts can be opened through Tab Banking:
Our Bank has rolled out Self Help Group (SHG) Savings Account opening digitally through TAB Banking-‘bob World Tab’. Our Bank is Pioneer public sector bank to digitize its SHG Account customer on-boarding process through tablets. “SHG Account Opening” is a part of Digital Transformation journey and will facilitate faster subsequent credit linkage to SHGs which is a thrust area for Govt. of India [Under Deendayal Antyodaya Yojana – National Rural Livelihood Mission (DAY-NRLM)].

Following Services currently offered through Tab Banking:

Internet banking
Mobile banking
Personalized debit card
Personalized cheque book
SMS alert
UPI/VPA/QR issuance
Issuance of FasTag.
Issuance of Credit Card.
During recent years, Tab Banking has emerged as the most preferred channel for branches and customers for its being convenient to use and being free of hassles.

Many products are likely to see the light of the day in the near future which can be summed up as follows—

Opening of Current Account for Companies.
Whats App Banking Registration.
Offering Life Insurance through India first.
Opening of Govt. Business products like SSA (Sukanya Samrudhi Account) & APY( Atal Pension Yojana)
The Platform of TAB Banking enables customer to enjoy freedom of opening account as per their comfort and instant activation of their accounts.

Customers can approach nearest branch, and open SB/ Current Account through bob World Tab enjoying a seamless banking experience, thereby."
1,"bob World Wave - A Wearable Contactless Payment Smart Watch Benefits
","Bank of Baroda has partnered with GOQii, one of the renowned smart health watch brands in India and a proud Make in India product, for its bob World Wave smart health watch.

Bank of Baroda’s on the go wearable payment solution, bob World Wave is designed to ensure expedient and seamless digital payments with just a tap of the device to meet the demands of our evolving customers
bob World Wave smart watch lets you monitor your SpO2, Body Temperature, Heart Rate, Blood Pressure, Menstrual/Pregnancy, Sleep and multiple activities and also helps you in making contactless payments
bob World Wave smart watch can be linked with the GOQii Mobile App which offers 3 months personal coaching subscription with certified health coaches and doctors
Virtual engagement program which rewards on completion of weekly steps targets and other health goals in the GOQii mobile app"
2,"Detail bob World Wave - A Wearable Contactless Payment Smart Watch
","Bank of Baroda’s on the go wearable payment solution, bob World Wave is designed to ensure expedient and seamless digital payments with just a tap on the device to meet the demands of our evolving customers. Customers can make payments on-the-go of up to INR 5,000/- without any PIN while shopping on any PoS machines enabled for contactless payments making it extremely convenient for the customers...."
3,"bob World Wave - A Wearable Contactless Payment Smart Watch : Features
","Contactless payments up to INR 5,000/- is eligible per transaction (with a maximum of 5 transactions per day) - without PIN (Tap and Pay)
Any contactless payment enabled transaction above INR 5000/- will require PIN authentication with a transaction limit of INR 1,00,000 at any POS terminal
Transact on e-commerce platforms for up to INR 1,00,000/- per day by referring to the Non-Payment Dummy card provided along with the device through CVV and OTP authentication
bob World Wave smart health watch - Smart Vital Plus is a CDSCO registered medical device & its services on the GOQii app (personal coaching, health locker, health store and more) are certified under 3 grades by the International Organization for Standardization (ISO)
Monitor health vitals like SpO2, Body Temperature, Heart Rate, Blood Pressure and Sleep. Track all day activities like steps, distance, calories burned & active time
This smart watch also has a special in-built feature for women to track their Menstrual cycle and Pregnancy
bob World Wave smart health watch: A 1.57"" full touch colour display with additional features like Smart Notifications, Music Control, Multiple Wallpapers, Alarms and more
This Smart Watch is also a graded IP68 Dust & Water Resistant device with a battery life of up to 7 days, under normal usage
The box includes a 2-pin magnetic charger. To charge the device, remove the strap and place the core correctly on the charger"
4,"bob World Wave - A Wearable Contactless Payment Smart Watch : Eligibility Criteria
","Eligible Mode of Operation :

Saving Bank Account: Either or Survivor, Self, Anyone or Survivor

Current Account: Self and Sole Proprietorship

Overdraft Account: Self

Eligible Account Schemes :

Baroda Bachat Mitra

Baroda Jeevan Suraksha SA

GOVT Scholarship /DBT Account

Baroda Advantage SB _GEN

Baroda Advantage SB _SAL

Baroda Advantage SB _PEN

Baroda Advantage SB _O_BAL

Baroda Centenary Savings Account

Baroda Pensioners Savings Account

Baroda First SB Dep account

Baroda Home Loan Linked SB account

SB Haryana State SS Pension

Baroda Shubh Savings

Baroda Salary Classic

Savings Bank Staff

Baroda Government Employee Salary Account

Baroda Super Savings

Baroda Platinum Savings Account

Baroda Salary Super

Baroda Salary Premium

Baroda Salary Privilege

Baroda Senior Citizen Privilege Savings Account

Baroda Mahila Shakti Savings Account

Baroda Salary Account for Defence & Police Personal

Baroda Expat Saving account

Baroda Advantage Current account

Baroda Premium Privilege

Baroda Premium Current account

Baroda Startup Current account

Baroda Scale up Current account

Staff Overdraft"
5,"bob World Wave - A Wearable Contactless Payment Smart Watch : Fees & Charges
","The MRP of Smart Vital Plus Health Watch is INR 6,499*/- (Inclusive of taxes) . However, as a special Launch offer the same is priced at a discounted price of INR 3,499*/- (Inclusive of taxes)
*The price of watch is further subjected to change as per the prevailing market conditions."
